quelle,labela,labelb1,labelc1,labelb2,labelc2,labelb3,labelc3,labelb4,labelc4,labelb5,labelc5,labeld,inhalt,index_binar
cc_ani_rus_16,test,unklar,unklar,N,N,N,N,N,N,N,N,N,мулла насреддин раз попросил у своего соседа
 котел через несколько дней он вернул котел и принес еще маленький котел что это значит
 спросил сосед твой котел сына родил ответил мулла насреддин по закону и обычаю он тебе
 принадлежит опять через несколько дней мулла явился к своему соседу и сказал ему одолжи
 мне еще раз котел тот отдал ему котел мулла взял его и ушел прошло много времени
 насреддин не показывался в конце концов сосед сам пошел к мулле и сказал отдай мне мой
 котел  твой котел умер ответил мулла а разве котел может умереть  как же ему не
 умереть спросил мулла если он мог родить сына то он мог также и умереть,0
